{
  "agents": [
    {
      "name": "hal",
      "role": "Unknown",
      "wired": false,
      "routes": [
        "hal"
      ]
    },
    {
      "name": "orchestrator",
      "role": "Unknown",
      "wired": true,
      "routes": [
        "orchestrator_contract",
        "orchestrator_plan",
        "orchestrator"
      ]
    },
    {
      "name": "ash",
      "role": "Unknown",
      "wired": true,
      "routes": [
        "ash"
      ]
    }
  ],
  "routes": [
    {
      "name": "agent_config",
      "file": "agent_config_routes.py",
      "wired": true,
      "endpoints": [],
      "schemas": []
    },
    {
      "name": "agent_context",
      "file": "agent_context_routes.py",
      "wired": true,
      "endpoints": [],
      "schemas": []
    },
    {
      "name": "agent",
      "file": "agent_routes.py",
      "wired": true,
      "endpoints": [],
      "schemas": []
    },
    {
      "name": "ash",
      "file": "ash_routes.py",
      "wired": true,
      "endpoints": [],
      "schemas": []
    },
    {
      "name": "core",
      "file": "core_routes.py",
      "wired": true,
      "endpoints": [],
      "schemas": []
    },
    {
      "name": "critic",
      "file": "critic_routes.py",
      "wired": true,
      "endpoints": [],
      "schemas": []
    },
    {
      "name": "cto",
      "file": "cto_routes.py",
      "wired": true,
      "endpoints": [],
      "schemas": []
    },
    {
      "name": "dashboard",
      "file": "dashboard_routes.py",
      "wired": true,
      "endpoints": [],
      "schemas": []
    },
    {
      "name": "debug",
      "file": "debug_routes.py",
      "wired": true,
      "endpoints": [],
      "schemas": []
    },
    {
      "name": "debugger",
      "file": "debugger_routes.py",
      "wired": true,
      "endpoints": [],
      "schemas": []
    },
    {
      "name": "delegate_stream",
      "file": "delegate_stream_routes.py",
      "wired": true,
      "endpoints": [],
      "schemas": []
    },
    {
      "name": "diagnostics",
      "file": "diagnostics_routes.py",
      "wired": true,
      "endpoints": [],
      "schemas": []
    },
    {
      "name": "drift",
      "file": "drift_routes.py",
      "wired": true,
      "endpoints": [],
      "schemas": []
    },
    {
      "name": "export",
      "file": "export_routes.py",
      "wired": true,
      "endpoints": [],
      "schemas": []
    },
    {
      "name": "fix",
      "file": "fix_routes.py",
      "wired": true,
      "endpoints": [],
      "schemas": []
    },
    {
      "name": "forge",
      "file": "forge_routes.py",
      "wired": true,
      "endpoints": [],
      "schemas": []
    },
    {
      "name": "guardian",
      "file": "guardian_routes.py",
      "wired": true,
      "endpoints": [],
      "schemas": []
    },
    {
      "name": "hal",
      "file": "hal_routes.py",
      "wired": false,
      "endpoints": [],
      "schemas": []
    },
    {
      "name": "health_monitor",
      "file": "health_monitor_routes.py",
      "wired": true,
      "endpoints": [],
      "schemas": []
    },
    {
      "name": "historian",
      "file": "historian_routes.py",
      "wired": true,
      "endpoints": [],
      "schemas": []
    },
    {
      "name": "loop",
      "file": "loop_routes.py",
      "wired": true,
      "endpoints": [],
      "schemas": []
    },
    {
      "name": "loop_validation",
      "file": "loop_validation_routes.py",
      "wired": false,
      "endpoints": [],
      "schemas": []
    },
    {
      "name": "memory_embed",
      "file": "memory_embed_routes.py",
      "wired": true,
      "endpoints": [],
      "schemas": []
    },
    {
      "name": "memory_recall",
      "file": "memory_recall_routes.py",
      "wired": true,
      "endpoints": [],
      "schemas": []
    },
    {
      "name": "memory",
      "file": "memory_routes.py",
      "wired": true,
      "endpoints": [],
      "schemas": []
    },
    {
      "name": "nova",
      "file": "nova_routes.py",
      "wired": true,
      "endpoints": [],
      "schemas": []
    },
    {
      "name": "observer",
      "file": "observer_routes.py",
      "wired": true,
      "endpoints": [],
      "schemas": []
    },
    {
      "name": "orchestrator_contract",
      "file": "orchestrator_contract_routes.py",
      "wired": true,
      "endpoints": [],
      "schemas": []
    },
    {
      "name": "orchestrator_plan",
      "file": "orchestrator_plan_routes.py",
      "wired": true,
      "endpoints": [],
      "schemas": []
    },
    {
      "name": "orchestrator",
      "file": "orchestrator_routes.py",
      "wired": true,
      "endpoints": [],
      "schemas": []
    },
    {
      "name": "output_policy",
      "file": "output_policy_routes.py",
      "wired": true,
      "endpoints": [],
      "schemas": []
    },
    {
      "name": "persona",
      "file": "persona_routes.py",
      "wired": true,
      "endpoints": [],
      "schemas": []
    },
    {
      "name": "pessimist_evaluation",
      "file": "pessimist_evaluation_routes.py",
      "wired": false,
      "endpoints": [],
      "schemas": []
    },
    {
      "name": "pessimist",
      "file": "pessimist_routes.py",
      "wired": true,
      "endpoints": [],
      "schemas": []
    },
    {
      "name": "plan_generate",
      "file": "plan_generate_routes.py",
      "wired": true,
      "endpoints": [],
      "schemas": []
    },
    {
      "name": "reflection",
      "file": "reflection_routes.py",
      "wired": true,
      "endpoints": [],
      "schemas": []
    },
    {
      "name": "sage",
      "file": "sage_routes.py",
      "wired": true,
      "endpoints": [],
      "schemas": []
    },
    {
      "name": "self",
      "file": "self_routes.py",
      "wired": true,
      "endpoints": [],
      "schemas": []
    },
    {
      "name": "sitegen",
      "file": "sitegen_routes.py",
      "wired": true,
      "endpoints": [],
      "schemas": []
    },
    {
      "name": "snapshot",
      "file": "snapshot_routes.py",
      "wired": true,
      "endpoints": [],
      "schemas": []
    },
    {
      "name": "train",
      "file": "train_routes.py",
      "wired": true,
      "endpoints": [],
      "schemas": []
    },
    {
      "name": "trust",
      "file": "trust_routes.py",
      "wired": true,
      "endpoints": [],
      "schemas": []
    }
  ],
  "schemas": [
    {
      "name": "agent_config_schema",
      "file": "agent_config_schema.py",
      "models": [
        "ToolPermission",
        "FallbackBehavior",
        "AgentConfigRequest",
        "AgentConfigResponse",
        "AgentConfigError",
        "AgentConfigGetRequest",
        "AgentConfigGetResponse"
      ],
      "used_in_routes": [],
      "validation_status": "Valid"
    },
    {
      "name": "agent_context_schema",
      "file": "agent_context_schema.py",
      "models": [
        "MemoryUsage",
        "LoopState",
        "LastAgentAction",
        "AgentContextRequest",
        "AgentContextResponse",
        "AgentContextError"
      ],
      "used_in_routes": [],
      "validation_status": "Valid"
    },
    {
      "name": "agent_contract_schema",
      "file": "agent_contract_schema.py",
      "models": [
        "AgentContract",
        "ContractViolation",
        "ContractValidationRequest",
        "ContractValidationResponse"
      ],
      "used_in_routes": [],
      "validation_status": "Valid"
    },
    {
      "name": "ash_schema",
      "file": "ash_schema.py",
      "models": [
        "AshAnalysisRequest",
        "RiskFactor",
        "AshAnalysisResult",
        "AshTestRequest",
        "TestResult",
        "AshTestResult",
        "AshErrorResult"
      ],
      "used_in_routes": [],
      "validation_status": "Valid"
    },
    {
      "name": "ceo_schema",
      "file": "ceo_schema.py",
      "models": [
        "CEOReviewRequest",
        "AgentAllocation",
        "CEOPlanResult",
        "CEOErrorResult"
      ],
      "used_in_routes": [],
      "validation_status": "Valid"
    },
    {
      "name": "critic_schema",
      "file": "critic_schema.py",
      "models": [
        "CriticReviewRequest",
        "CriticScores",
        "CriticUsage",
        "CriticReviewResult",
        "CriticRejectRequest",
        "CriticRejectResult",
        "CriticLogReasonRequest",
        "CriticLogReasonResult",
        "CriticErrorResult"
      ],
      "used_in_routes": [],
      "validation_status": "Valid"
    },
    {
      "name": "cto_schema",
      "file": "cto_schema.py",
      "models": [
        "CTOAuditRequest",
        "CTOIssue",
        "CTOAuditResult",
        "CTOErrorResult"
      ],
      "used_in_routes": [],
      "validation_status": "Valid"
    },
    {
      "name": "debug_schema",
      "file": "debug_schema.py",
      "models": [
        "LoopDebugRequest",
        "LoopIssue",
        "RepairSuggestion",
        "LoopDebugResult"
      ],
      "used_in_routes": [],
      "validation_status": "Valid"
    },
    {
      "name": "debugger_schema",
      "file": "debugger_schema.py",
      "models": [
        "PatchPlan",
        "DebuggerReport",
        "DebuggerTraceRequest",
        "DebuggerTraceResult"
      ],
      "used_in_routes": [],
      "validation_status": "Valid"
    },
    {
      "name": "delegate_stream_schema",
      "file": "delegate_stream_schema.py",
      "models": [
        "StreamRequest",
        "StreamResponse",
        "StreamError",
        "StreamStatusRequest",
        "StreamStatusResponse",
        "StreamCloseRequest",
        "StreamCloseResponse",
        "StreamEvent"
      ],
      "used_in_routes": [],
      "validation_status": "Valid"
    },
    {
      "name": "drift_schema",
      "file": "drift_schema.py",
      "models": [
        "DriftMonitorRequest",
        "LoopDriftLog",
        "DriftMonitorResponse"
      ],
      "used_in_routes": [],
      "validation_status": "Valid"
    },
    {
      "name": "export_schema",